{
  "schemaVersion": 2,
  "id": "portugues-completo",
  "title": "Português Completo",
  "description": "Fixture P1 do slice N0/N4 para validar o contrato de catálogo; não representa publicação atual.",
  "levels": [
    {"id": "N0", "order": 0, "title": "Fundamentos"},
    {"id": "N4", "order": 4, "title": "Domínio"}
  ],
  "units": [
    {"id": "N0-U01", "levelId": "N0", "order": 1, "title": "Fala, sons e escrita", "manifest": "units/001-fala-sons-escrita/unit.json"},
    {"id": "N4-U09", "levelId": "N4", "order": 9, "title": "Literatura, multimodalidade, autoria intermedial e digital", "manifest": "units/409-literatura-multimodalidade-autoria-intermedial-digital/unit.json"}
  ]
}
